{
  "id": "SI.SOURCE.MVI.SLOVENIAN.CURRICULUM.2025",
  "title": "Učni načrt – Slovenščina",
  "source_type": "CURRICULUM",
  "organization": "Ministrstvo za vzgojo in izobraževanje Republike Slovenije",
  "official": true,
  "url": "https://www.gov.si/assets/ministrstva/MVI/Dokumenti/Osnovna-sola/Ucni-nacrti/Ucni-nacrti/2025/UN_OS/Ucni_nacrt_slovenscina_2025.pdf",
  "document_version": "2025",
  "effective_from": "2026-09-01",
  "effective_to": null,
  "retrieved_at": null,
  "page": null,
  "section": null,
  "original_title": "UČNI NAČRT – IME PREDMETA: slovenščina",
  "notes": "Učni načrt za izobraževalni program osnovne šole. Strokovni svet Republike Slovenije za splošno izobraževanje ga je določil na 244. seji dne 22. 5. 2025. Na uradni strani GOV.SI je različica označena kot v uporabi od 1. 9. 2026."
}
