{
  "id": "SI.SOURCE.MVI.SLOVENIAN.FIRST_PERIOD.2025",
  "title": "Učni načrt za prvo vzgojno-izobraževalno obdobje",
  "source_type": "CURRICULUM",
  "organization": "Ministrstvo za vzgojo in izobraževanje Republike Slovenije",
  "official": true,
  "url": "https://www.gov.si/assets/ministrstva/MVI/Dokumenti/Osnovna-sola/Ucni-nacrti/Ucni-nacrti/2025/UN_OS/Ucni_nacrt_za_prvo_vzgojno-izobrazevalno_obdobje_2025.pdf",
  "document_version": "2025",
  "effective_from": "2026-09-01",
  "effective_to": null,
  "retrieved_at": null,
  "page": null,
  "section": null,
  "original_title": "OSNOVNA ŠOLA – Prvo vzgojno-izobraževalno obdobje – Učni načrt",
  "notes": "Uradni učni načrt za prvo vzgojno-izobraževalno obdobje osnovne šole. Strokovni svet Republike Slovenije za splošno izobraževanje ga je določil na 244. seji dne 22. 5. 2025."
}
